Full Name, Brand, Category Name, Properties, MRP, Discount
Colour Imp Color Pen Set Pack of 6 Nos 1 Pc, Colour, Colour Pen, 1 Pc, 129, 0
Colour Imp Color Pen Neon Pack of 6 Nos 1 Pc, Colour, Colour Pen, 1 Pc, 129, 0
Maped Jungle Sketch Pen 12 Nos Pack 1 Pc, Maped, Colour Pen, 1 Pc, 275, 0
Artline Paint Brush Pony Haired Pack of 4 Nos 1 Pc, Artline, Colour Pen, 1 Pc, 70, 0
Maped Clear Paper Imagine Sketch Pens 24 Nos Pack 1 Pc, Maped, Colour Pen, 1 Pc, 270, 0
Camlin Premium BI Colour Pencils Shade-24 1 Pc, Camlin, Colour Pen, 1 Pc, 150, 0
Artline Water Soluble Pencils 12 Nos, Artline, Colour Pen, 12 Nos, 150, 0
Artline Water Soluble Pencils 24 Nos, Artline, Colour Pen, 24 Nos, 300, 0
Apsara Oil Pastels 24 Colors 1 Pc, Apsara, Colour Pen, 1 Pc, 60, 0
Faber Castell 4 Multimark Fine 151304 4 Nos, Faber Castell, Colour Pen, 4 Nos, 80, 0
Maped Clear Paper Imagine Sketch Pens 12 Nos Pack 1 Pc, Maped, Colour Pen, 1 Pc, 140, 0
Camlin Oil Pastel Jumlobo 24-Shades With Reusable Plstic Pack 1 Pc, Camlin, Colour Pen, 1 Pc, 150, 0
Camlin Oil Pastel 25-Shades With Reusable Plstic Pack 1 Pc, Camlin, Colour Pen, 1 Pc, 100, 0
Cello Funtoons Chisel Marker 1 Pc, Cello, Colour Pen, 1 Pc, 80, 0
