Full Name, Brand, Category Name, Properties, MRP, Discount
Parachute 100% Pure Coconut Oil 100ml, Parachute, Hair Oil, 100ml, 28, 0
Parachute 100% Pure Coconut Oil 175ml, Parachute, Hair Oil, 175ml, 50, 0
Parachute 100% Pure Coconut Oil 250 ml, Parachute, Hair Oil, 250 ml, 72, 0
Parachute 100% Pure Coconut Oil 500 ml, Parachute, Hair Oil, 500 ml, 140, 0
Baba Ramdev Patanjali Coconut Oil 210 ml, Baba Ramdev Patanjali, Hair Oil, 210 ml, 65, 0
Baba Ramdev Patanjali Amla Hair Oil 100 ml, Baba Ramdev Patanjali, Hair Oil, 100 ml, 40, 0
Parachute Advansed Jasmine Coconut Hair Oil 90 ml, Parachute, Hair Oil, 90 ml, 35, 0
Parachute Advansed Jasmine Coconut Hair Oil 200 ml, Parachute, Hair Oil, 200 ml, 75, 0
Parachute Advansed Jasmine Coconut Hair Oil 300 ml, Parachute, Hair Oil, 300 ml, 120, 0
Parachute Advansed Coconut Hair Oil 75 ml, Parachute, Hair Oil, 75 ml, 45, 0
Parachute Advansed Coconut Hair Oil 170 ml, Parachute, Hair Oil, 170 ml, 80, 0
Parachute Advansed Coconut Hair Oil 300 ml, Parachute, Hair Oil, 300 ml, 135, 0
Dabur Amla Hair Oil 90 ml, Dabur, Hair Oil, 90 ml, 42, 0
Dabur Amla Hair Oil 180 ml, Dabur, Hair Oil, 180 ml, 84, 0
Dabur Amla Hair Oil 300ml, Dabur, Hair Oil, 300ml, 125, 0
Dabur Amla Hair Oil 450 ml, Dabur, Hair Oil, 450 ml, 190, 0
Bajaj Almond Drops Non Sticky Hair Oil 200 ml, Bajaj, Hair Oil, 200 ml, 115, 0
Bajaj Almond Drops Non Sticky Hair Oil 300 ml, Bajaj, Hair Oil, 300 ml, 150, 0
Parachute 100% Pure Coconut Oil Jar 1 Ltr, Parachute, Hair Oil, 1 Ltr, 291, 0
Parachute Advansed Ayurvedic Hot Oil 190 ml, Parachute, Hair Oil, 190 ml, 110, 0
Parachute Advansed Ayurvedic Hot Oil 300 ml, Parachute, Hair Oil, 300 ml, 160, 0
Parachute Advanced Ayurvedic Hair Oil 95 ml, Parachute, Hair Oil, 95 ml, 62, 0
Parachute Advanced Ayurvedic Hair Oil 190 ml, Parachute, Hair Oil, 190 ml, 118, 0
Parachute Advanced Ayurvedic Hair Oil 300 ml, Parachute, Hair Oil, 300 ml, 175, 0
Clear Anti Dandruff Active Care Hair Oil 150 ml, Clear, Hair Oil, 150 ml, 90, 0
Hair & Care Non Sticky Hair Oil 200 ml, Hair & Care, Hair Oil, 200 ml, 95, 0
Dabur Almond Hair Oil 100 ml, Dabur, Hair Oil, 100 ml, 60, 0
Dabur Almond Hair Oil 200 ml, Dabur, Hair Oil, 200 ml, 115, 0
Dabur Almond Hair Oil 500 ml, Dabur, Hair Oil, 500 ml, 250, 0
Bajaj Almond Drops Hair Oil 100 ml, Bajaj, Hair Oil, 100 ml, 60, 0
Bajaj Almond Drops Hair Oil 500 ml, Bajaj, Hair Oil, 500 ml, 250, 0
Himani Ayurvedic Navratna Cool Oil 100 ml, Himani, Hair Oil, 100 ml, 66, 0
Himani Ayurvedic Navratna Cool Oil 200 ml, Himani, Hair Oil, 200 ml, 120, 0
Himani Ayurvedic Navratna Cool Oil 300 ml, Himani, Hair Oil, 300 ml, 160, 0
Himani Ayurvedic Navratna Cool Oil 500 ml, Himani, Hair Oil, 500 ml, 240, 0
Mediker Natural Coconut Based Anti Lice Oil 50 ml, Mediker, Hair Oil, 50 ml, 30, 0
Himalaya Anti Hair Fall Hair Oil 100 ml, Himalaya, Hair Oil, 100 ml, 100, 0
Himalaya Anti Hair Fall Hair Oil 200 ml, Himalaya, Hair Oil, 200 ml, 180, 0
Livon Hair Gain Tonic 150 ml, Livon, Hair Oil, 150 ml, 685, 0
Clinic Plus Daily Care Nourishing Hair Oil 150 ml, Clinic Plus, Hair Oil, 150 ml, 85, 0
Biotique Avocado Body Massage Oil 210 ml, Biotique, Hair Oil, 210 ml, 135, 0
Fresh Coconut Regular 1 Nos, Fresh, Fresh Vegetables, 1 Nos, 20, 0
Fresh Beetroot 500 g, Fresh, Fresh Vegetables, 500 g, 21, 0
Fresh Mint Bunch 1 pc, Fresh, Fresh Vegetables, 1 pc, 7.5, 0
Fresh Bitter Gourd 750 g, Fresh, Fresh Vegetables, 750 g, 45, 0
Fresh Garlic Whole Regular 300 g, Fresh, Fresh Vegetables, 300 g, 45, 0
Fresh Green Peas 500 g, Fresh, Fresh Vegetables, 500 g, 110, 0
Fresh Basket Broccoli 500 g, Fresh Basket, Fresh Vegetables, 500 g, 120, 0
Fresh Colacasia Arvi Roots 250 g, Fresh, Fresh Vegetables, 250 g, 17, 0
Fresh Gooseberry Indian Amla 250 g, Fresh, Fresh Vegetables, 250 g, 30, 0
Fresh Mushroom Button Unit Pack 1 pc, Fresh, Fresh Vegetables, 1 pc, 46, 0
Fresh Cluster Beans 250 g, Fresh, Fresh Vegetables, 250 g, 14.5, 0
Fresh Basket Potato 1 Kg, Fresh Basket, Fresh Vegetables, 1 Kg, 28, 0
Fresh Brinjal Long White 500 g, Fresh, Fresh Vegetables, 500 g, 19, 0
Fresh Drumsticks 250 g, Fresh, Fresh Vegetables, 250 g, 20, 0
Fresh Amranths Red Bunch 1 pc, Fresh, Fresh Vegetables, 1 pc, 7, 0
Fresh Pointer Gourd (Parval) 500 g, Fresh, Fresh Vegetables, 500 g, 60, 0
Fresh Basket Onion Packed 1 Kg, Fresh Basket, Fresh Vegetables, 1 Kg, 20, 0
Fresh Basket Onion Packed 5 Kg, Fresh Basket, Fresh Vegetables, 5 Kg, 95, 0
Fresh Avocado 500 g, Fresh, Fresh Vegetables, 500 g, 160, 0
Fresh European (English) Cucumber 500 g, Fresh, Fresh Vegetables, 500 g, 24, 0
Fresh Snake Gourd 500 g, Fresh, Fresh Vegetables, 500 g, 27, 0
Fresh Suran (Elephant Yam) 300 g, Fresh, Fresh Vegetables, 300 g, 16.5, 0
Fresh Radish Red 250 g, Fresh, Fresh Vegetables, 250 g, 14.5, 0
Fresh Banana Flower 1 Nos, Fresh, Fresh Vegetables, 1 Nos, 15, 0
Fresh Turnip 250 g, Fresh, Fresh Vegetables, 250 g, 27.5, 0
Fresh Banana Stem 1 pc, Fresh, Fresh Vegetables, 1 pc, 15, 0
Fresh Lettuce Iceberg 500 g, Fresh, Fresh Vegetables, 500 g, 80, 0
Fresh Basket Zucchini Green 350 g, Fresh Basket, Fresh Vegetables, 350 g, 42, 0
Fresh Local Cucumber 500 g, Fresh, Fresh Vegetables, 500 g, 31, 0
Fresh Kappa 500 g, Fresh, Fresh Vegetables, 500 g, 18, 0
Fresh Tinda 250 g, Fresh, Fresh Vegetables, 250 g, 30, 0
Fresh Baby Corn 500 g, Fresh, Fresh Vegetables, 500 g, 85, 0
Fresh Lotus Root 100 g, Fresh, Fresh Vegetables, 100 g, 29, 0
Fresh Basket Zucchini Yellow 250 g, Fresh Basket, Fresh Vegetables, 250 g, 35, 0
Fresh Onion Madras 1 Kg, Fresh, Fresh Vegetables, 1 Kg, 105, 0
Healthy Sweet Corn Peri Peri 1 Pc, Healthy, Fresh Vegetables, 1 Pc, 35, 0
Fresh Basket Celery (Indian) 500 g, Fresh Basket, Fresh Vegetables, 500 g, 47.5, 0
Fresh Basket Cucumber American Zero Pesticide 500 g, Fresh Basket, Fresh Vegetables, 500 g, 24.5, 0
Fresh Chilli Small Round 250 g, Fresh, Fresh Vegetables, 250 g, 55, 0
Fresh Basket Chinese Cabbage 1 Kg, Fresh Basket, Fresh Vegetables, 1 Kg, 95, 0
Fresh Basket Bitter Gourd Mini Zero Pesticide 250 g, Fresh Basket, Fresh Vegetables, 250 g, 14.75, 0
